{
  "schema": "fusion.evidence/v1",
  "id": "ead9c136-6967-40a0-930a-f454eb67a324",
  "workbench_id": "4f7b1e34-e80b-4092-a4d3-fbb66e342c9e",
  "subject": {
    "git_tree": "30d3561c3683e48b92402e97474e883a404b4c37",
    "git_range": null
  },
  "brief_revision": "sha256:d4bce591e53231c2b68e079a36168f47b889dd0453a257ae8bbe4063130cda10",
  "plan_revision": "sha256:26be2013f493a1a60446479e713cbcb0f54a5f44e9a1660d4623e5a9d7a372e9",
  "role": {
    "profile": "reviewer",
    "version": "13.0.0"
  },
  "host": "claude-code",
  "execution_policy": "claude-guided",
  "verdict": "accept",
  "uncertainties": [],
  "checks": [],
  "report": {
    "path": "work-packages/261017-1605-migrate-landed-cell-docs-stale-condition/reviews/261017-1637-reviewer-closing-pass-over-the-migrate-landed-cell-docs-stale-condition-package.md",
    "sha256": "sha256:5a919ed781a63a556561a1d4a518e61fbaa7a0aff84f04034db994ecdba4cce5",
    "kind": "review"
  },
  "predecessor": null,
  "accepted_at": "2026-10-17T14:38:31Z",
  "extensions": {}
}
